,Review,Rating,Date,Restaurant Name
620,"The oysters are excellent.  They served probably 10 different types, from CT, MA, RI, ME, and WA, along with of course, two sizes of clams on the half shell.   If you are an oyster fan, you will definitely appreciate the freshness and quality (although you are paying the premium).   Had one of the appetizers, the Crab Scampi (basically gourmet lasgnepasta and rich chese with lump crab),  which was very tasty.  However, I couldn't help but asking myself if any  other dish pumped full with the same amount of fat would be just as good...Was not happy with the service at all.  Went around 7pm on a friday with my gf,  hoping to have some raw bar and drinks  before going to dinner at a favorite.  We had to wait 30 minutes to get in, until we were seated in a uncomfortably cramped table which was shared with another couple.  Later on, the waitress made a big deal over the fact that we did not order entrees--- unnappropriate considering our drinks,  raw bar and appetizers alone racked up a  50+ dollar tab.  I understand you are trying to make a f-ing living, but way to make your customers feel unwanted...Can't speak about the entrees firsthand but , other patrons seemed to be pleased with their dishes.Next time I get a craving for oysters, ill buy a couple dozen at the market and shuck'em myself.  Neptune wasn't worth the trip or the dent in the wallet",3,2/5/2007,Restaurant Neptune Oyster
621,"Some of the best seafood you will find in the city can be found here. Small and cozy, not like Legal Seafoods. The staff is friendly, courteous, and they all know what they're talking about when it comes to food and wine. The owner is always there, and always friendly. The menu is definitely original. Each entree has a little something different that you can't get anywhere else. A little pricey, but well worth it.",5,2/10/2007,Restaurant Neptune Oyster
622,"If you like fresh seafood, look no further.  First off this place is small, but very well done.  White marble tables, tin ceilings and a small bar area.  They don't take reservations, so I usually only got with one other person to make things easier.The food is very interesting, it's the only place I have found that serves octopus, which I love.  If you want a neighborhood type place and one that takes some chances with the menu check this place out.",5,3/11/2007,Restaurant Neptune Oyster
623,"had a huge plate of oysters, about six varieties, all very very good. had both lobster rolls (hot and cold) and the cioppino, which was also excellent. prompt friendly service.the bathroom is right at the end of the bar and there's only one so if ya gotta drop a deuce, hold it for later.",4,4/2/2007,Restaurant Neptune Oyster
624,"Anyone who knows Boston knows that that North End, Boston's Italian neighborhood, is notorious for it's narrow streets, lack of parking, and great restaurants. Neptune Oyster is one of those great restaurants.The restaurant is tiny with not much of a waiting area. When my wife and I got there, the place was packed. No room for us inside the door so we stood outside and waited.The restaurant is longer than it is wide with an L-shaped booth-like bench stretching along the entire left side of the space and half of the back wall. Several tables were jammed together in front of the bench with chairs on the other side. With seating for twenty-six at the tables and another ten at the bar, which ran along the right side of the restaurant, this place might be considered large by some North End standards. The very front of the restaurant, just inside the etched glass window fronting the sidewalk, was the raw bar where J and I watched the show. Rows and rows of shellfish, and a woman shucking oysters like she was pouring water into a glass. Smooth, effortless, perfect.After about ten minutes outside and another twenty minutes inside, we sat down at a table. J and I started our night off with two glasses of NV Borgo Magredo Prosecco and a dozen oysters. Four Wellfleet, medium sized, salty, and sweet; four kumomoto, small, sweet, plump, and creamy with hints of cucumber; and four Fanny Bay, medium sized, plump, low salt, sweet, and buttery with a melon finish. Neptune Oyster has a dozen different oysters to choose from as well as little necks, cherry stones, and shrimp cocktail braised in Harpoon beer.Moving on to course two, we shared Neptune's Bottarga Salad. Bottarga is cured fish roe and is delicious. This salad was fantastic with Boston lettuce, red grapes, fennel, caramel onions, white anchovy, grape seed oil and a Parmesan dressing.With dinner we drank a bottle of Carpe Diem Chardonnay from the Firepeak vineyard in Edna Valley, California. J ordered Neptune's Gloucester Cod Loin served with stewed tri peppers, oregano, mustard, freshly grated horseradish and a grapefruit vinaigrette. The plate was garnished with supremes of grapefruit.I ordered the Fillet of Salmon with a saute of crispy duck, pea tendrils, avocado, ginger and soy. Both of our entrees were truly spectacular, but J's cod loin dish may very well be the best dish of the year. The cod was cooked to perfection and the spicy horseradish was balanced so well by the sweet, tart grapefruit, the mustard and the oregano. The cod dish was definitely the star of the meal.Now for the best part of the evening. We return to the car to find a carefully placed PARKING TICKET on the windshield! Sometime between the last time I was in the North End and last Friday night, Hanover Street converted all the on-street parking to Residents Only after 8pm.Oh well. Neptune Oyster is awesome and worth a parking ticket. I'll make sure not to park on Hanover Street the next time I go.",5,4/12/2007,Restaurant Neptune Oyster
625,"This place has the best lobster rolls ever. Unadorned. Huge chunks. Fresh. Delicious. You can actually choose to have it with mayo or just butter. Go for the butter.The oysters of course were incredible - one of the few places you get Kumamoto oysters. That and the Windy Bay are my favorites. The fried oysters are heavenly as well. I  can't wait to go back to this place.So why the 4 stars instead of 5? The place cannot seem to find a manager with the good sense to stock them well enough for a weekend nights. Three times I have gone there (and twice that another friend went) they were out of lobster rolls by 6pm. Come on people - figure it out. Weekend = stock up on lobster!!Besides that, this place is tops.",4,4/17/2007,Restaurant Neptune Oyster
626,"Hi, I just read the burger article & thought there should be a shout out for the Neptune burger - it's a giant patty of goodness topped off w/ fried oysters.",4,5/8/2007,Restaurant Neptune Oyster
627,"Everything at this place was yummy!  We went for a late lunch and the waiter was super friendly...we had some mimosas, oysters, a lobster roll and the yellowtail crudo was to die for.  The waiter gave us a delicious dessert wine after our meal...on the house.  I can't wait to go back next time i'm in boston.",5,5/14/2007,Restaurant Neptune Oyster
628,Oysters on the half shell plus fried oysters equals oyster heaven!  Believe it or not this place has converted me to an oyster lover.  The staff is really friendly and helpful even though the place is really small and a tiny bit tricksy to maneuver.  I am constantly daydreaming about this place..  yum,5,5/17/2007,Restaurant Neptune Oyster
629,"In Roman lore, Neptune is a god (named after the Greek deity Poseidon.) In Boston, there is a god of seafood restaurants named Neptune Oyster. From their much heralded lobster rolls to their fantastic chowder to the city's best selection of oysters, a seafood lover cannot go wrong. Sturgeon, monkfish, and sublime ciopinno. I've been here for business lunches and dinners with mi amore. It's a great setting for either occasion.",5,6/13/2007,Restaurant Neptune Oyster
630,"Wow. really, Wow.This place is amazing.I have to say, outside of sushi, I am rarely amazed at what people do with fish.  This place really sets the bar.I went to dinner with a group of friends and there was not a single dish was not amazing.The salmon melts in your mouth, the stergin rocked the house, the marlin (served two ways) was spectacular, the trout amazing, the oysters were fresh and delicious.I save my five star ratings for the places that are ""must go to if you're anywhere near there"" and this place suits the bill Spectacularly.",5,6/14/2007,Restaurant Neptune Oyster
631,"I have never been SOOOO sick!  I had a horrible case of food poisoning after eating here.  I had the crab meat salad and the scallops.  However, I just tasted the scallops (they had a liquorice taste which I did not like and were not cooked through) and switched with my boyfriend who had fish - so, it had to be the crab because the fish was cooked through.  I was sick within an hour of eating and sick throughout the night.  I enjoyed the atmosphere, and we had a really nice waiter - but I would not eat there again after the agony that followed.  Also, terrible parking situation, which is normal in the North End.I REALLY wanted to like this place - but in the end, I was too sick to ever go back.",1,6/16/2007,Restaurant Neptune Oyster
632,Came here with friends who were visiting from out of town. We heard it was a top rated restaurant in the country. It was quite amazing! It was a very memorable experience- and I want to go back very soon! I loved it! The oysters were Fantastic!,5,6/18/2007,Restaurant Neptune Oyster
633,"Did not have a chance to have the oysters!  Will definitely come back for that.So what are the five stars for?  The FANTABULOUS Ciopini (seafood stew).  The spices were just right, large shrimp, clams, mussels... yummmmm.  The atmosphere was great, friendly co diners too.  Not touristy which adds to two stars right there!  If you visit Boston, this is a must!",5,6/24/2007,Restaurant Neptune Oyster
634,"Super cute oyster bar.  Kind of a European feel.  Unfortunately, I didn't think the food was all that great--especially considering the priciness.  The one standout was the crab louis salad--a heap of luscious crab, lightly dressed with almond vinaigrette on tender Boston lettuce.  Disappointing clam chowder (watery and missing the rich clam flavor), although the homemade (?) oyster crackers were a nice touch.  Shrimp cocktail was delicious but absurdly expensive ($3+ for ONE shrimp!),and the lobster roll was wayyy overdressed with mayo.  Most vexing of all, I think the oysters weren't as fresh as some others that I've tasted at Turner Fisheries and Bouchee.   But then again, I will admit that we visited on a Sunday, so they probably didn't have the freshest supply.  I would return just because it's so darn cute, but keep it simple with a glass of prosecco and a couple oysters on the half shell at the bar.",3,7/28/2007,Restaurant Neptune Oyster
635,"The food gods have guided me for years and my third visit to Neptune was testament to their power.  After a long day of moving daughter out of BU (the moving in review is below) I was exhausted and left her to party with her friends.  Upon returning to the Park Plaza I surveyed the neighborhood and resigned myself to eat at Legal Seafood (just some fish and white wine I kept telling myself, how can they screw that up?).  As I was walking toward the door a couple passed me and I overheard this comment:  ""I have been tricked into going to Legal Seafood three times and each time it sucked""....This was a message to go forth and find dinner.  I started walking through the Theatre District and then passed the common without purpose when it hit me, I was heading to North End and a return to Neptune Oyster.  And I was rewarded.Sitting at the bar with cordial service (not cloying but friendly enough) and  a good local ale I started with a grilled sardine, yes one large grilled sardine, over a slice of pancetta with wedge of iceberg lettuce and blue cheese dressing and did it work.  The main was a local bass over a perfect succotash (fresh peas, green beans, and a touch of pancetta) topped with a light vinaigrette.  Every ingredient shined and the flavors weren't buried by unnecessary saucing.Really enjoyed the glass of brocheto (I think that is what they called it) for dessert, a slightly sweet Italian sparkler and walked home to the hotel a happy satisfied customer.I can't agree more with the other reviewers, this place a gem and the third time was the charm.  I try not to return to restaurants but I will be going back to Neptune.  Sure, it is a little rough around the edges, if you want to be coddled, go somewhere else....And 9 months ago.....We hit the Neptune Oyster bar twice in two days, once for dinner with the hon and then for lunch the next day with hon an daughter freed from her orientation at BU and starving.Dinner first.  Got to sit next to wife, always a plus, clam chowder was very good lots of clams and agree with Jenny, the home made oyster crackers were great.  I also agree that $3 a shrimp is very steep as was the chowder ($11).  Still the oysters were wonderful and we left full and content although I admit as someone not from the area the lobster roll (hot) left me confused.  The brioche was knockout though.Lunch was equally pricey, I was stunned at the $10 fruit/champagne cocktails, not the quality but the price of these drinks.    The chowder at lunch was a bit salty and while I could forgive it at a lesser price for that money the chowder has to be perfect.  We spent over 100 on soup, salads and drinks....So the atmosphere is five stars and the wine list is solid and the food is four stars but because of the price structure it just slips it down to three.",5,7/30/2007,Restaurant Neptune Oyster
636,"So I will start this review out by saying that I did not eat at this restaurant. With that said, I was surprised that with a 4.5 star rating this restaurant felt just about as claustrophobic as an overcrowded closet space. I had to scoot my seat in twice in the few minutes I was there to let people through the main entrance - the proportions of which seemed more fitting for a back exit! Decor doesn't seem to be their thing either. I was surprised by tables and chairs that were more fitting for a diner than a fine seafood restaurant.Then there was the problem of their poor supply of seafood. They were out of lobster meat even though it was only 6:30 on a Saturday evening! Now I don't know about you, but the North End probably receives the greatest bulk of its patronage on a Saturday evening and they're telling me there's no more lobster?! The hostess was not all that polite either and didn't show up until after we decided to finally seat ourselves after standing, waiting and ultimately feeling ignored by everyone that seemed like they worked there.While I'm sure the food has much to offer given the rave reviews, I must play devil's advocate and say that until Neptune gets a better floor plan, learns how to more effectively match their food supply to the demand of North End patrons - the inclusion of cocktails wouldn't hurt either - and give their customer service a major overhaul I will have to rate this as I would any other sub-par restaurant, 2 stars. If you expect good service, comfortable eating conditions and a fully stocked menu Neptune is not for you.",2,8/19/2007,Restaurant Neptune Oyster
637,"I ended up here on a whim friday night and boy was it memorable. My friend and I were sorta hungry and wandered in around 7pm. The place was fairly full but there happened to be two seats at the bar so we sidled up.The decor of this place is great. Its cozy, timeless, tasteful it feels vintagey and european, carefully detailed but simple and understated.My experience here was nothing but positive. The bartender was incredibly sweet and totally laid-back for friday night dinner scene. She excitedly relayed the recent celebrity clientele Justin Timberlake and Kate Hudson, but was decidedly as polite and friendly to us as I'm sure she was to them.We felt no pressure to order an abundance of food or to drop wads of cash.  We sampled oysters all excellent, that came via a handy and descriptive menu, location, price, flavor profiles for each type. My friend got the veal and tuna tartare sandwich an unlikely combo, it was awesome served on toasted brioche with a grainy mustard, cucumber salad and solid fries. I literally pored and lingered over the menu, everything sounded delicious. There were tons of unusual flavor profiles, food combinations and several cuisine influences. Far from standard seafood house options.I decide on squid diavola which was grilled and then stewed in a spicy delicious tomato sauce with beans and isreali couscous. I would definitely go back here with more of an appetitie so I could really eat my way through the menu. For an unplanned Friday night this was by far the most memorable meal of the summer, not bad for wandering off the T after work.",5,8/21/2007,Restaurant Neptune Oyster
638,"A favorite neighborhood spot of ours, Neptune Oyster rarely disappoints.  The oysters are fresh and delicious but expect to be shoulder to shoulder with other diners.  It's not a spot for a quiet, romantic dinner but rather a fun night out spent sitting at the wine bar and enjoying the seafood.  Last night, a rainy Tuesday evening, we sauntered in around 7pm and were fortunate to find a nearly deserted bar.  The bartender quickly took our drink orders - favorites from the beer & wine list that we've discovered on other visits -  a glass of the Pigato white wine for me (a delicious Italian light, dry white) and a Whale's Tale Pale Ale for my husband.  A few oysters followed.  Our tried and true favorite is the Island Creek which we mixed with 2 less familiar names.  Neptune serves what is fresh and in season so there is always a new mollusk  to sample.  After drooling over it on other visits, my husband had the Neptuneburger and was it delicious.  Served on a brioche bun and topped with a fried oyster and garlic aoli, it's filling and I was lucky to have a quarter of it land on my plate!  I had the Crab Louis Salad (over butter lettuce with a nutty vinaigrette) and it was also good.  It must have had over a pound of crab on it.  On other visits, I've ordered the cioppino which is also a good choice and the lobster roll is full of big chunks of meat.  Neptune has certainly been ""discovered"" since we first dined there but my fingers are crossed that they never expand and stay true to their oyster/wine bar charm!",4,9/12/2007,Restaurant Neptune Oyster
639,"Oh. My. Gawd. I was pretty blown away by this place last night. It was as if some higher power created a restaurant just for me (except it would serve beer... guess not everything can be perfect). They have an oyster list that's just as extensive as their wine list, and I wanted to try one of each... unfortunately, I only have so much money, so I only ordered a few of them. Each oyster was even better than the last. I was trying to find a favorite, but it's like asking a parent to pick their favorite kid. It can be done, but you just don't want to have to make that choice.I had the neptune burger after my sampling of oysters, and it was amazing. A big, beefy burger topped with fried oysters? YES PLEASE. Not too bad for $13 either (It was the cheapest entree item on the menu. Order anything else and expect to pay at least double that... but know that it will be worth it, no matter what it is). I also tried a little bit of my friend's lobster roll, and whoa mama! I want to live here and eat oysters all day long. Is that okay, Neptune Oyster?***EDIT*** I just went again this weekend, and they DO serve beer!!! They just don't have them listed on the menu, but they're right there on the bar in full view (unless the place is packed with people, which it usually is because it's so tiny). This place really IS perfect!!!",5,9/19/2007,Restaurant Neptune Oyster
640,"Came here for dinner and to try a duxbury oyster after reading the reviews on here.  I also ordered Monk fish and my friend had the Marlin.  Gotta say, they did Monk right!  It had the texture of lobster, yay!!  I tried a slice of Marlin and it was delicious!  I'll definitely be back.  Warning though, parking around here sucks!",5,9/29/2007,Restaurant Neptune Oyster
641,"This was a major change. My usual bring the bratty ""GIMMIE SEAFOOD I'M IN BOSTON! WHINE WHINE LOBSTER ROLL. C'MON LET ME GET SOME CHOW-DA IN A BREAD BOWL"" out of town guests place has always been Union Oyster House or some dingy place like No Name Restaurant/Summer Shack.. or pasta seafood places like The Daily Catch. Those places aren't bad.. they just don't do it for me personally. In fact.. I don;t really hear running excitement of the mouth from the tourists either. They just turn silent and kind of let me take them to neighborhood hole in wall's after that.. which is good for me.. but sort of saddening.Neptune Oysters gon' dit it and killed it... in a living sense way.I've got to tell you.. Yelp did a good job placing this as one of the top Seafood in Boston places. I've also got to tell you how pissed off I was when we sat in this tiny place and looked at the prices. I felt uncomfortable for bringing two other people with me here.. but blah blah blah..as soon as we started eating and the glasses of wine followed..it was all monopoly money and Rich Millionaire was back in business. The mood in there made me feel like cash too. Jazz, that white tile against the dim yellow brown-ish sexy lighting in large leather booth night time clean 40's diner ---oh baby.Liked the easy to order check off oyster list with simple descriptions.  I recommend going hobo style and splitting half's of the oyster burger and HOT lobster roll's with another.. try both. SOOOOOOO GOOOOODDDD.So stuffed. So going back with every single one of the losers who come to visit.",5,10/9/2007,Restaurant Neptune Oyster
642,"in my search for the ultimate lobster roll in boston, all of my sources insisted, nay, demanded that i try this place. i was not disappointed. i had it warm. it came tossed with butter (perhaps a tad too much) on brioche, with fries. it was everything i hoped it would be and more. my companions had the clam chowder and a roasted celery salad, both of which received an enthusiastic thumbs up. i feel the tiniest bit of guilt because one of my dinnermates is a vegetarian, and all she could eat was some lettuce and my fries. but honestly only a smidge -- i would push my grandmother down the stairs for another lobster roll.parking is a bitch, but the restaurant is located close to the haymarket station on the green line. it was crazy busy when i went (saturday night, regatta weekend), and the wait was an hour and a half. i'd do it again in a heartbeat.",5,10/31/2007,Restaurant Neptune Oyster
643,"This review covers two restaurants, namely B&G Oysters and Neptune Oysters, and only one dish at each of these restaurants, namely their lobster rolls.  Why, my dear friends, would I go to these two places with the sole purpose of trying out their respective takes on this classic New England dish?  Because it's a crap-load of lobster on a bun... that's why.With that said, the styles of these two lobster rolls are completely different:  warm and buttery vs. cold and mayonnaise-y.  Obviously, the cold version is the ""classic"" lobster roll, and there has been a plethora of posts about how a warm roll is akin to going to the Democratic National Convention and proclaiming that George Bush Jr. is the best president ever.  I have never been a traditionalist, so I am reviewing these dishes for what they are.First the similarities:1. You get a lot of lobster... not just enough to fill the bun, but enough to REQUIRE eating a good number of fork-fulls before picking the damn thing up and trying to take a bite out of it.  Unfortunately, I learned this the hard way, and ended up spilling about a tail's-worth of lobster meat onto my plate when I tried to take a bite from the get-go.2. Each goes really well with a beer, preferably something that can stand up to the natural butteriness of the lobster meat.  I suppose you could get a nice acidic white, but a nice New England draught (Geary's Winter Ale at Neptune and Tremont Ale at B&G) seemed like the perfect accompaniment to me.Differences:1. B&G:  cold lobster in a light aioli with lemon and chives sprinkled on top.  The lemon gave the dish the perfect amount of acid to balance the lobster.  Not really mayonnaise-y at all.  Lobster chunks broken up to just the right size so when you take a bite out of the roll, you don't have to chew through a piece of lobster or get an overly large piece in your mouth.2. Neptune:  warm lobster in butter on a toasted brioche bun.  The warmth allowed me to fully enjoy all the natural (and added) butteriness of the lobster.  Often times large chunks of lobster that were obviously crab or tail meat.  While a bit harder to eat, the large chunks gave me the impression that there was some dude in the back who cracked open a fresh lobster, chopped it up a bit, put it in the bun and splash some butter on it.The service in each place was great.  The decor was a bit different, with Neptune sporting marble tables and an old-school oyster bar feel, while B&G had a more modern touch with a nice open kitchen in the middle of the restaurant where you can watch them do their magic.Both of these places are must-go's, even if you only like lobster a wee little bit.  I'll be back next time I'm in town, but I think I'll bring some cholesterol-lower medications just in case...",4,11/9/2007,Restaurant Neptune Oyster
