,Review,Rating,Date,Restaurant Name
0,"I was fortunate enough to be invited to the ""soft opening"" of this restaurant last night.  It is located in the former home of cafe graffiti on Hanover St.  This restaurant features some really large windows that completely open up to give the ""outdoor seating experience"" to the entire restaurant.  They are set to open officially this Friday night.  The food was exceptional.  They brought us numerous dishes from the menu including mushrooms in truffle foam (to die for), filet, fried calamari, swordfish and many more.  The dishes were full of flavor and really got your mouth happy.  I wish I could give them an extra star for the amount of wine they poured in my glass.  I left there very very happy.  I will definitely be back once they officially open up.One side note they don't serve coffee or dessert.  The owner feels that is part of the entire North End experience.  He thinks after a good meal you should walk around, stop in the shops and end your visit with a stop at your favortie pastry shop.",5,8/14/2008,Carmelina's
1,"It's a nice, modern Italian restaurant, a good place for a date, somewhat loud with very tasty food and excellent service. We especially enjoyed the scallops and the accommodating attitude of the wait staff.",4,8/31/2008,Carmelina's
2,"I was visiting Boston on business from San Francisco and had never been to Hanover Street before.  I had a great meal at Ristorante Damiano.  I just wish I wasn't alone and could have ordered more!  The outstanding dishes I had were the Seared Scallops with Grapefruit Chile Glaze, Lamb Lollipops, and Pasta Carbonara.It was great to find this restaurant with a more modern edge - there were tons of other restaurants with very similar menus.  The service was also great.  I was sitting in the back of the restaurant and was able to watch the staff who seemed to work together very well.  They checked every glass they picked-up to make sure it was spotless!Please give this place a try if you haven't been there yet.  I just wished I could have ordered a cocktail here.",5,9/27/2008,Carmelina's
3,"I'm finding it hard to believe no one else gave a ""tapas"" take on Italian food sooner. I'm of the type that usually goes out and ends up sitting at the bar so I don't feel bad just ordering a couple appetizers as my meal. Of course, then you're limited to appetizer-like food. Damiano has entree-type offerings, indivudally prepared as small portions. Food was excellent, but there are a few unique characteristics of this place I enjoyed very much and warrant a higher rating:-No reservations (No, thats not a negative...when Friday night comes and you want dinner but didn't have the forethought to book a reservation and dont want to wait 1-2 hours there is now a better option!) -All wines available by the glass. -Lots of specials to choose from, so you don't get bored on your second and third visits.",5,10/9/2008,Carmelina's
4,This place has an amazing wine by the glass selection - it's the only place I've found that you can find a barolo by the glass!Beyond the wine - everything I've had there has been great.  They recently had a goat cheese topped fillet. Yum!  AND I have the mushroom risotto on a weekly basis!   Try it out!,5,11/5/2008,Carmelina's
5,"The food was wonderful - excellent quality and taste and nice presentation. My only criticism is that I felt rushed by the waiter. A couple of times he tried to take our plates away when we weren't finished. Also, when we arrived at about 7 (on a weeknight) he tried to seat us at a little table squeezed in on the far wall. Since there were only 2 other tables with people at them, I asked to be moved to one of the larger tables at at the window - the waiter was accomodating.",4,11/14/2008,Carmelina's
6,"Seems like Francesca wants to hunt me down and personally put the smack down on me! Good thing yelp is fairly anonymous. To reiterate my original message: I liked the risotto, I thought everything else we got was not that great. BUT I went early on in their time open, perhaps things are different now, as so many people have enjoyed it. I am so glad that everyone has had a good time! That's what I love-- people enjoying their dining out.",3,12/3/2008,Carmelina's
7,"This place was delish.Small, intimate, with a great (awesome, fantastic, cannot stress enough how lovely) staff. I went with three of my friends at random - we were just roaming around the North End looking for somewhere to eat.  We chose Damianos because there wasn't much of a line, but there were plenty of people inside, and their menu was intriguing. We were seated promptly, waited on attentively by an adorable waitress and a very charming waiter. We immediately had bread and water, and our drink orders taken. Damianos offers a selection of piattini (I think that's what they're called), and they're essentially Italian tapas - and they were effing amazing, seriously. Between the four of us, we tried eight different dishes, each of which was more delectable than the last. Skillfully prepared, attractively presented, with awesome fresh ingredients (and if you want my advice and you're into mushrooms, get the wild mushroom risotto and the mushroom dish (there are like five kinds of mushrooms in it) with truffle oil. Oh jesus. Oh mary). I think this'd be a great place to take a date, except sadly, you'll only get to try four dishes instead of eight, which is sad for you both! Nonetheless, the atmosphere, good wine, great service, and incredible food should console you well enough.  Yay!",4,12/7/2008,Carmelina's
8,"Sorry but some one needs to be negative and I guess it's going to be me. Now I am not going to say the food is awful, because it's not. It's just that you can get the same quality food almost anywhere else in the North End area and even better food at some places (if your willing to pay for it) the thing with Damianos is that the portions to price ratio is awful, for the same price I can get the same quality food and a lot more.... But like I said the food is good",2,12/13/2008,Carmelina's
9,"Damiano's puts a spin on the traditional North End eatery. While there are similarities to other establishments (romantic atmosphere, great wine, small dining room) the menu is much different. Unlike any other North End restaurant, tapas are served here. While portions are always a top priority of mine, 4 ""piatini's"" satisfied my dining parter and I. Music and atmosphere often set a tone for the meal. I was impressed with their trendy tunes. They did not distract dicussions, but were a pleasant cacophony in the background...I highly suggest Damianos and will dine there again. I purchased a gift card for my sister and brother in law because I think they will love it!",4,12/22/2008,Carmelina's
10,"It's cozy and sweet inside; I had a wonderful experience here, but I could see how it could go awry.  We had great food, great service, and great wine.  I was surprised to see how reasonably priced it was!!! Overall, this is a great place to eat and to enjoy a long meal. I would recommend that you try to take the upper hand in the situation starting from when you first walk in.  I definitely see how other people have been walked on.",5,12/25/2008,Carmelina's
11,I have eaten here a bunch of times with some friends and we have always been very happy.  We order a whole variety of things and never get that stuffed feeling after eating Italian Food. One of the best in the North End.,5,1/7/2009,Carmelina's
12,"After posting a similar review on boston.com's Dining Chat, I received the below message from the chef and owner of Ristorante Damiano.  In his defense, I posted it.  My reply is below as well.Hi Kim, I am the owner/chef of Damiano that allegedly yelled and screamed at you and your date and everyone else that night. I was going to let it go until I saw that you continue to slam me to Devra First on Dining Chat. Do you have a personal issue with me? I was cordial and nice to both of you. My daughter and staff were completely shocked at your yelp review. They could not believe your allegations. We were happy to accomodate you that late in the evening and we didn't rush you at all, like many other places would have. There was no yelling at anyone. I find it hard to believe that you would speak untruths, but then again, I don't know you. You were both thinking about the edamame and that's why I sent it complimentary. And believe it or not, even in ""piattini"" style, the food should be brought to you in a certain order, with the sea bass being the last dish. BTW you did not cut into the seabass, it was intact. As far as texting goes, it was late at night and Prezza needed to borrow some food form us because they were short. I never yell at my daughter, She is the most precious and important person in my life. I can let your review go right by me and not bother me. Please do not slander me or my daughter and please stop this nonsense. Let it go. You don't like my restaurant, that's fine. But please do stop the lies. I have a full staff and a daughter that were all here that night. I joked and thought i was being not only pleasant but making sure I served you the best food and that you received it in the proper way, as I always do. Nonetheless, you were a paying customer and I would be happy to make it up to you if you ever decide to come back. You can reach me via this system.Thank you, DamienDamien,I'm someone who dines out frequently.  I sometimes Yelp about it, but I almost always chat on boston.com.  I give positive reviews and I give negative reviews, depending on my experience.  I have eaten at some of the finest restaurants in the world, and some of the worst.  I hold no personal grudges, and I approach each with an open mind.  As you can read in my Yelp review, I said I enjoyed the food at your restaurant.  Actually, I said our last two course were ""undeniably delicious"".  While I was somewhat disheartened by the risotto, I cannot deny that it had amazing flavor.  I also said you had a great and reasonably priced wine list, and that the service was friendly.I never said that your staff rushed us, and I wouldn't expect any restaurant to do so, whether we got there a half house before the kitchen closed or a few minutes before it did so.Perhaps our definitions of yelling are different (I come from a soft-spoken English family), but I fondly remember you calling over loudly to your servers demanding to know who brought us the dish.  I also did not say that you yelled AT your daughter; I said you yelled TO her.  I'm sorry if you took offense to my wording, although I did find it inappropriate that you would give her food that had sat in front of us.  As someone with past restaurant experience, I would have been fired on the spot for doing that in front of a diner.As far as the sequence of courses, it has also been my understanding that small plates are presented as they are cooked.  I did some quick research and found that others are under the same impression.  The following quote from food writer Kathryn Matthews was featured on Portfolio.com, the website of worldwide magazine publishing company, Conde Nast (responsible for food magazines such as Bon Appetite and Gourmet):""Another valuable benefit is that small plates are served on an ""as ready"" basis (rather than sequentially like a traditional meal)"" (portfolio.com/culture-li…).I believe that you love your daughter and was in no way intending on slandering either of you.  I merely gave my review based on the experience I had that night.  I don't believe that I insulted her in any way.  I gave an honest review, as I always do.  However, in your defense, I will post your message to me under my review so that other readers hear both sides of the story.Once again, I sincerely apologize if you took offense as that was not my intention.Regards,Kim",2,1/30/2009,Carmelina's
13,"Interesting concept. Smaller plates (piattini) of food . A nice option when you don't want a gut busting North End meal. The food was very good. I tried the duck breast and seared sea scallops. The duck breast was ok, a little on the bland side and not as rare as I wanted. The seared sea scallops with grapefruit, chili pepper glaze and oyster mushrooms was excellent. Others in our dinner  party tried scallops with pasta and lemon, pasta carbonara and a foie gras stack. The foie gras stack was a real standout. Tiny dining room but great spot to watch people walking up and down Hanover street. Good selection of wines. Two plate minimum. A nice addition to the North End.",4,2/12/2009,Carmelina's
14,"I'd like to reiterate that the food here is top notch. It is really delicious!And, as for the service, after the fact, it was absolutely superb. The owner of Damiano personally contacted me to apologize for my not-so-great experience with Damiano's service. Then, he insisted that I visit his friend at his restaurant in San Francisco (where I live!) and that his friend would take extra-special care of me and my boyfriend. Amazing! So go for the food and say hello to the amazing owner Damian for me!!!",5,2/13/2009,Carmelina's
15,"The food is fantastic and the wine by the glass selection is great.  So why only 3 stars?  First, it is so noisy it is impossible to conduct a conversation.  There is loud music playing on top of the loud din of conversation.  Next, the pace of the food service is so fast, it feels like a fast service restaurant (the TV on the wall adds to that feel).  We told our waiter that we wanted a slow pace, but he said the pace would be determined by the kitchen.  Thereafter, the food was set on our table so fast we couldn't keep up with it.  Once all the dishes were put on the table, our waiter disappeared and we had to track him down to get more wine.  We were never asked whether we wanted anything else - we were just handed the bill so that they could turn over the table.  A friend of mine mentioned that the best time to go is on a week night and to only order a couple of dishes at a time.  That will probably work if you can find the waiter when its time to add to your order.  The kitchen needs to really chill out so that diners can relax.  And turn down the music!",3,2/17/2009,Carmelina's
16,"The food here is simply amazing. I've been telling all of my friends! I've been here twice and had the sea scallops (to die for), the caprese salad, the lamb, the butternut squash risotto and the calamari. Everything was great. The decor and ambience are really modern and provide for a much different experience than the rest of the North End..(that's a good thing..)My only complaint has been with the service. The last server I had was messy, careless and impatient. My other experience I was served the incorrect risotto, however this mistake was promptly fixed. Hopefully they're able to beef up the experience a bit.",4,2/25/2009,Carmelina's
17,"Damiano is a incredible restaurant! They serve piattini plates similar to tapas but Italian styleThe decor is loving, the bathroom is clean , modern and the kitchen is right there in the center for you to view ..... You know who is cooking your food and it's piping hot when you get it. I like the style of getting your food (paced) served to according to how long it takes to prepared.....  as it's made..... I enjoy this style of delivery... because it reminds me of eating with my family in stages and it keeps coming.... The serves makes you feel like your at home warm and comfortable and the waiters are soo good looking... Your  waiter can be found in a second and is a delighted to serve you with charm and quick wit..... ask for Nick I would definitely recommend the seared sea scallops  , the Romanian salad, the soups and shrimp seafood pasta dishes. The owner chef comes to your table and says hi and that is a plus in my book! Great wines for good prices. In the summer , the glass windows open up and you can view the street of Hanover. I gonna keep on going back and try everything on the menu",5,3/1/2009,Carmelina's
18,"I have to agree with all of the positive reviews. Especially Lori V. We ate here recently and can not wait to go back! We also had Nick as a server and he was FANTASTIC, very charming and witty, (not to mention very handsome!) It was our first time dining at Damiano. We were familiar with the ""tapas style"" but were a bit unsure as to how to decide on what to pick/how many plates to pick/etc... so because we thought everything on the menu sounded delicious (which is rare) we decided to allow him to chose for us! And he seemed quite enthused on doing so. So he started us off with a tuna carpaccio topped with extra virgin olive oil gelato... absolutely to die for! Our second course was a REAL carbonara.. no cream, no peas! And again, amazing! We finished with the sea bass pistachio, finished with a saffron blood orange sauce. This was our favorite! And also a black garlic filet mignon which was cooked to a perfect medium rare! Overall this could be one of the best dining experiences I have ever had. Everything was perfect from the front to the back of the house.",5,3/1/2009,Carmelina's
19,"Yesterday my husband and I did a double date to the North End.  We did not plan where we would go but rather stumbled into this establishment because none of us had ever been.  I always love new places and have sympathy for the growing pains of a new business, especially a restaurant.  In this case however the service was so awful I was beyond irritated, and the food hardly compensated.  I am not easily impressed by the fact the portions are so small they seem like they should taste delicious but no matter how many drizzles or creams you place on my plate I can not ignore the fact my food was just not good.  Perhaps it was the fact that by the time the rest of my table got their plates I had my food sitting in front of me for over ten minutes so it was dried up and rubbery (I had the stuffed calamari).  I would assume by the two mediocre pieces of Calamari that they could at least cook them so they wouldn't taste like a tire but appearance is deceiving.  Unfortunately our waitress also ignored us for the first about 15 minutes we were sitting, and in a place that accommodates approximately 15 tables it is hard to not notice a table of four staring around distressed.   The only way we got her attention was by asking the hostess where she was.  After we placed our drink orders she forgot half the order which was only waters all around and then when we requested waters she brought ONE!  Our meals came out separately with several minutes in between which is a huge pet peeve of mine.  The first meal that came to the table was mistakenly given to our table then removed a few minutes later for another table.   I will never return here because you would think $140 would fill up four people or at least be delicious but alas I left starving and annoyed with just how long we were there sitting twiddling our thumbs.",1,3/29/2009,Carmelina's
20,"I am a cynic when it comes to North End restaurants. I've lived in the neighborhood and worked the bar at a lot of them. That's why I was ecstatic when I found Ristorante Damianos. It's charming, with pictures of the chef's family in Italy blown up on the wall and a friendly bar scene where you can watch Damian comprise his surprising concoctions. The tuna meatballs are so good, they are actually worth driving around the neighborhood trying to score street parking so you don't get ripped off by the valets that have taken over Hanover Street. The spaghetti carbonara is so amazing, I have friends who have dreamt about it. (Okay, the friends are actually me.) The artichoke salad is comprised of, gee, delicious  fresh artichokes. This tapas-like eatery is a welcome addition to the North End. Best of all, the tourists are actually hip in here. There is a reason the Boston Globe called it one of the city's best new hotspots.",5,4/2/2009,Carmelina's
21,The few small plates we had while sitting at the bar where Ok but definitely over priced. We did however enjoy the mini bottles of prosecco that turn out to be more than 1 full glass for a reasonable $8 or $9. I am only giving three stars because of the price and also because the service was not the most friendly. At this time when spending is under scrutiny I am not sure I would go back here.,3,4/3/2009,Carmelina's
22,"I took a year off after college many years ago and traveled through Italy with friends. I came to love the food like it was a part of me. My wife and I get a chance to go to Boston three or four times a year, and we always go to the North End to eat. Over the many years we have found some we call our favorites, and I am always hesitant to try something new. My wife convinced me to try the new place Damiano on Hanover Street, and I can say without hesitation, it's my new favorite, not plural. The small plates, the smells, the atmosphere, everything reminded of my days in Italy. It actually reminded me of the little places in Sicily I used to love to go to eat.  This is a very good, authentic Italian restaurant, from the food right down to the wait staff.  You can't go wrong here, period.",5,4/20/2009,Carmelina's
23,"Ate there last night. Great selection of $20-$25 bottles of wine and the small plate approach allows you to try many things without being totally stuffed (2 plates per person at $10-$15 per plate is the norm). We had the spaghetti carbonara, the tuna meatballs (a bit bland, but good), the spicy shrimp and the mushroom risotto. All were very well prepared and had that special touch you expect from an Italian place on the North End. Service was great and very personable. Another plus, the decor was nice and kitchen is RIGHT there in case you enjoy watching the chef cook.",4,4/30/2009,Carmelina's
24,"The horrid service completely undermined the EXCELLENT food.Food was brought out very sporadically throughout the meal, and the waitress made many timing-related mistakes.  Initially - for example, when the bread was brought (apologetically) to us after we had already finished our 1st course - I didn't care.But then, all main courses were served except for mine.  Again, at first I waited patiently - I was sharing a 2nd dish with someone else, so had something to eat while I waited.Then the waitress came over to check how our meal was before I even had mine!  I answered 'it's good, but I'm still waiting for my pasta', and she acted like it was intentional that I didn't have my dish - her explanation was that we were all supposed to be sharing all the dishes, so it shouldn't matter if something comes out later than the rest.  But - it was obvious that we WEREN'T all sharing all the dishes - our orders were taken by person, no extra plates were given as is usually the case in 'family style' serving.  And besides, I actually WAS sharing with someone else at the table, and we had already finished the 2 other dishes we had ordered!So - this is the worst part - everyone finished their food, and the waitress was CLEARING THE TABLE - and my pasta STILL had not even been made!  As she was clearing the table, I asked her again about it, and she didn't really say anything - just ran back to the kitchen.  Then, she came back about 10 minutes later with THE WRONG DISH!  Finally - after we were all REALLY done with dinner - my pasta came.  They gave an extra serving and small plates to the rest of the table so I wouldn't have to eat alone.  Nice enough, but really the LEAST possible compensation given the circumstances.TO THE MANAGEMENT: I hope, for your own sake, that you can improve your service.   I would love to refer others to Damiano's based on the fantastic food and exciting menu.  But I can't - the service so completely destroyed my experience.",2,5/13/2009,Carmelina's
25,"Favorite spot in Boston, hands down.  Food is amazing, not too pricey and what a good concept (italian tappas).  If you are looking for something in the North End, Italian, different this is a must try and you will fall in love.  Have a cigar across the street after for an amazing evening.  Make sure you order 2-3 plates, under that is not enough and over that is stuffing your face and contributing to America's already overly obese society.",5,6/5/2009,Carmelina's
26,"My wife and I had recently dined at Damiano and had a fairly good experience but if you are looking for a fun and relaxing place to go this will NOT be your best choice. The place is small and VERY fast paste, not somewhere where you can sit and enjoy your time. The restaurant has an open kitchen with a screaming chef who is over powering the music. Our server came over almost crying after being bed mouthed from the chef in front of the entire restaurant. We felt absolutely uncomfortable. Food is good and the idea of italian tapas is very clever but it's not something outstanding or mind blowing for a $150 dinner for two. We left the restaurant extremely distressed of the way the staff was being treated and the rush of the atmosphere. I hope you all have a better experience then we did.",3,6/8/2009,Carmelina's
27,"We had a wonderful dinner there last night.  We had a large group, the staff did a great job serving, amazing service, and, the food was fantastic. Highly recommend the baby eggplant, and cod.  Loved the atmosphere.",4,7/4/2009,Carmelina's
28,"Although the service can sometimes be uneven (though in my experience never unfriendly, just overwhelmed), this is one of my favorite spots in Boston.  Sure, it's loud and crowded, but you're on Hanover Street, not at a corner table at The Oak Room.  The food is excellent, and I love the piattini or ""small plate"" concept because you get to try several things at once.  The wine list is tops, too.  Don't miss the risotto - it melts in your mouth.",5,7/8/2009,Carmelina's
